<?xml version="1.0" encoding="UTF-8"?> 
<geografiamundial xmlns:xsi="http://www.w3.org/2001/XMLSchema-instance"
    xsi:noNamespaceSchemaLocation="040203.xsd"> 
 <pais nombre="EspaÃ±a"> 
 <continente>Europa</continente> 
 <capital>Madrid</capital> 
 </pais> 
 <pais nombre="Portugal"> 
 <continente>Europa</continente> 
 <capital>Lisboa</capital> 
 </pais> 
 <pais nombre="Argentina"> 
<continente>America del Sur</continente> 
<capital>Buenos Aires</capital> 
</pais> 
<pais nombre="Marruecos"> 
<continente>Africa</continente> 
<capital>Rabat</capital> 
</pais> 
<pais nombre="Jordania"> 
<continente>Asia</continente> 
<capital>Amman</capital> 
</pais> 
</geografiamundial>